Aguascalientes,Baja California,Baja California Sur,Campeche,Chiapas,Chihuahua,Ciudad de México,Coahuila,Colima,Durango,Estado de México,Guanajuato,Guerrero,Hidalgo,Jalisco,Michoacán,Morelos,Nayarit,Nuevo León,Puebla,Querétaro,Quintana Roo,San Luis Potosí,Sinaloa,Sonora,Tabasco,Tamaulipas,Tlaxcala,Veracruz,Yucatán,Zacatecas
Órgano Superior de Fiscalización,Órgano Superior de Fiscalización,Órgano Superior de Fiscalización,Órgano Superior de Fiscalización,Órgano Superior de Fiscalización,Órgano Superior de Fiscalización,Órgano Superior de Fiscalización,Órgano Superior de Fiscalización,Órgano Superior de Fiscalización,Órgano Superior de Fiscalización,Órgano Superior de Fiscalización,Órgano Superior de Fiscalización,Órgano Superior de Fiscalización,Órgano Superior de Fiscalización,Órgano Superior de Fiscalización,Órgano Superior de Fiscalización,Órgano Superior de Fiscalización,Órgano Superior de Fiscalización,Órgano Superior de Fiscalización,Órgano Superior de Fiscalización,Órgano Superior de Fiscalización,Órgano Superior de Fiscalización,Órgano Superior de Fiscalización,Órgano Superior de Fiscalización,Órgano Superior de Fiscalización,Órgano Superior de Fiscalización,Órgano Superior de Fiscalización,Órgano Superior de Fiscalización,Órgano Superior de Fiscalización,Órgano Superior de Fiscalización,Órgano Superior de Fiscalización
Fiscalía Especializada en Combate a la Corrupción,Fiscalía Especializada en Combate a la Corrupción,Fiscalía Especializada en Combate a la Corrupción,Fiscalía Especializada en Combate a la Corrupción,Fiscalía Especializada en Combate a la Corrupción,Fiscalía Especializada en Combate a la Corrupción,Fiscalía Especializada en Combate a la Corrupción,Fiscalía Especializada en Combate a la Corrupción,Fiscalía Especializada en Combate a la Corrupción,Fiscalía Especializada en Combate a la Corrupción,Fiscalía Especializada en Combate a la Corrupción,Fiscalía Especializada en Combate a la Corrupción,Fiscalía Especializada en Combate a la Corrupción,Fiscalía Especializada en Combate a la Corrupción,Fiscalía Especializada en Combate a la Corrupción,Fiscalía Especializada en Combate a la Corrupción,Fiscalía Especializada en Combate a la Corrupción,Fiscalía Especializada en Combate a la Corrupción,Fiscalía Especializada en Combate a la Corrupción,Fiscalía Especializada en Combate a la Corrupción,Fiscalía Especializada en Combate a la Corrupción,Fiscalía Especializada en Combate a la Corrupción,Fiscalía Especializada en Combate a la Corrupción,Fiscalía Especializada en Combate a la Corrupción,Fiscalía Especializada en Combate a la Corrupción,Fiscalía Especializada en Combate a la Corrupción,Fiscalía Especializada en Combate a la Corrupción,Fiscalía Especializada en Combate a la Corrupción,Fiscalía Especializada en Combate a la Corrupción,Fiscalía Especializada en Combate a la Corrupción,Fiscalía Especializada en Combate a la Corrupción
Contraloría General,Contraloría General,Contraloría General,Contraloría General,Contraloría General,Contraloría General,Contraloría General,Contraloría General,Contraloría General,Contraloría General,Contraloría General,Contraloría General,Contraloría General,Contraloría General,Contraloría General,Contraloría General,Contraloría General,Contraloría General,Contraloría General,Contraloría General,Contraloría General,Contraloría General,Contraloría General,Contraloría General,Contraloría General,Contraloría General,Contraloría General,Contraloría General,Contraloría General,Contraloría General,Contraloría General
Consejo de la Judicatura,Consejo de la Judicatura,Consejo de la Judicatura,Consejo de la Judicatura,Consejo de la Judicatura,Consejo de la Judicatura,Consejo de la Judicatura,Consejo de la Judicatura,Supremo Tribunal de Justicia,Consejo de la Judicatura,Consejo de la Judicatura,Consejo del Poder Judicial,Consejo de la Judicatura,Consejo de la Judicatura,Consejo de la Judicatura,Consejo de la Judicatura,Consejo de la Judicatura,Consejo de la Judicatura,Consejo de la Judicatura,Consejo de la Judicatura,Consejo de la Judicatura,Consejo de la Judicatura,Consejo de la Judicatura,Supremo Tribunal de Justicia,Consejo de la Judicatura,Consejo de la Judicatura,Consejo de la Judicatura,Consejo de la Judicatura,Consejo de la Judicatura,Consejo de la Judicatura,Tribunal Superior de Justicia
"Órgano Garante en Materia de Transparencia, Acceso a la Información y Protección de Datos Personales","Órgano Garante en Materia de Transparencia, Acceso a la Información y Protección de Datos Personales","Órgano Garante en Materia de Transparencia, Acceso a la Información y Protección de Datos Personales","Órgano Garante en Materia de Transparencia, Acceso a la Información y Protección de Datos Personales","Órgano Garante en Materia de Transparencia, Acceso a la Información y Protección de Datos Personales","Órgano Garante en Materia de Transparencia, Acceso a la Información y Protección de Datos Personales","Órgano Garante en Materia de Transparencia, Acceso a la Información y Protección de Datos Personales","Órgano Garante en Materia de Transparencia, Acceso a la Información y Protección de Datos Personales","Órgano Garante en Materia de Transparencia, Acceso a la Información y Protección de Datos Personales","Órgano Garante en Materia de Transparencia, Acceso a la Información y Protección de Datos Personales","Órgano Garante en Materia de Transparencia, Acceso a la Información y Protección de Datos Personales","Órgano Garante en Materia de Transparencia, Acceso a la Información y Protección de Datos Personales","Órgano Garante en Materia de Transparencia, Acceso a la Información y Protección de Datos Personales","Órgano Garante en Materia de Transparencia, Acceso a la Información y Protección de Datos Personales","Órgano Garante en Materia de Transparencia, Acceso a la Información y Protección de Datos Personales","Órgano Garante en Materia de Transparencia, Acceso a la Información y Protección de Datos Personales","Órgano Garante en Materia de Transparencia, Acceso a la Información y Protección de Datos Personales","Órgano Garante en Materia de Transparencia, Acceso a la Información y Protección de Datos Personales","Órgano Garante en Materia de Transparencia, Acceso a la Información y Protección de Datos Personales","Órgano Garante en Materia de Transparencia, Acceso a la Información y Protección de Datos Personales","Órgano Garante en Materia de Transparencia, Acceso a la Información y Protección de Datos Personales","Órgano Garante en Materia de Transparencia, Acceso a la Información y Protección de Datos Personales","Órgano Garante en Materia de Transparencia, Acceso a la Información y Protección de Datos Personales","Órgano Garante en Materia de Transparencia, Acceso a la Información y Protección de Datos Personales","Órgano Garante en Materia de Transparencia, Acceso a la Información y Protección de Datos Personales","Órgano Garante en Materia de Transparencia, Acceso a la Información y Protección de Datos Personales","Órgano Garante en Materia de Transparencia, Acceso a la Información y Protección de Datos Personales","Órgano Garante en Materia de Transparencia, Acceso a la Información y Protección de Datos Personales","Órgano Garante en Materia de Transparencia, Acceso a la Información y Protección de Datos Personales","Órgano Garante en Materia de Transparencia, Acceso a la Información y Protección de Datos Personales","Órgano Garante en Materia de Transparencia, Acceso a la Información y Protección de Datos Personales"
Tribunal de Justicia Administrativa,Tribunal de Jusitica Administrativa,Tribunal de Jusitica Administrativa,Tribunal de Jusitica Administrativa,Tribunal de Jusitica Administrativa,Tribunal de Jusitica Administrativa,Tribunal de Jusitica Administrativa,Tribunal de Jusitica Administrativa,Tribunal de Jusitica Administrativa,Tribunal de Jusitica Administrativa,Tribunal de Jusitica Administrativa,Tribunal de Jusitica Administrativa,Tribunal de Jusitica Administrativa,Tribunal de Jusitica Administrativa,Tribunal de Jusitica Administrativa,Tribunal de Jusitica Administrativa,Tribunal de Jusitica Administrativa,Tribunal de Jusitica Administrativa,Sala Especializada en materia de Responsabilidades Administrativas del Tribunal de Justicia Administrativa,Sala Especializada en Materia de Responsabilidades Administrativas del Tribunal de Justicia Administrativa,Tribunal de Justicia Administrativa,Tribunal de Justicia Administrativa,Tribunal de Justicia Administrativa,Tribunal de Justicia Administrativa,Tribunal de Justicia Administrativa,Tribunal de Justicia Administrativa,Tribunal de Justicia Administrativa,Tribunal de Justicia Administrativa,Tribunal de Justicia Administrativa,Tribunal de Justicia Administrativa,Tribunal de Justicia Administrativa
Contraloría del Municipio de Aguascalientes,Sindicatura del Municipio de Playas de Rosarito,,,,,Consejo de Evaluación de Desarrollo Social,,,,,Órgano Interno de Control del Municipio de San Luis de la Paz,,Comisión de Transparencia y Anticorrupción del Congreso,,Órgano Interno de Control del Municipio de Briseñas,Representante de los Contralores Municipales ,,,,,,,,,,,,,,
Contraloría del Municipio de Asientos,Sindicatura del Municipio  de Tijuana,,,,,Órgano de Control del Congreso,,,,,Órgano Interno de Control del Municipio de Guanajuato,,Contraloría del Municipio de Zapotlan de Juárez,,Órgano Interno de Control del Municipio de Indaparapeo,,,,,,,,,,,,,,,
Contraloría del Municipio de Calvillo,Sindicatura del Municipio  de Mexicali,,,,,,,,,,Órgano Interno de Control del Municipio de Apaseo el Alto,,Contraloría del  Municipio de Zimapán,,Órgano Interno de Control del Municipio de Epitacio Huerta,,,,,,,,,,,,,,,
Contraloría del Municipio de Cosío,Sindicatura del Municipio  de Tecate,,,,,,,,,,Órgano Interno de Control del Municipio de Moroleón,,Contraloría del  Municipio de Tlaxiaca,,,,,,,,,,,,,,,,,
Contraloría del Municipio de El Llano,Sindicatura del Municipio de Ensenada ,,,,,,,,,,,,Contraloría del  Municipio de Tezontepec,,,,,,,,,,,,,,,,,
Contraloría del Municipio de Jesús María,Sindicatura del Municipio de San Quintín,,,,,,,,,,,,Contraloría del  Municipio de Emiliano Zapata,,,,,,,,,,,,,,,,,
Contraloría del Municipio de Pabellón de Arteaga,Sindicatura del Municipio de San Felipe,,,,,,,,,,,,,,,,,,,,,,,,,,,,,
Contraloría del Municipio de Rincón de Romos,,,,,,,,,,,,,,,,,,,,,,,,,,,,,,
Contraloría del Municipio de San Francisco de los Romo,,,,,,,,,,,,,,,,,,,,,,,,,,,,,,
Contraloría del Municipio de San José de Gracia,,,,,,,,,,,,,,,,,,,,,,,,,,,,,,
Contraloría del Municipio de Tepezalá,,,,,,,,,,,,,,,,,,,,,,,,,,,,,,
